{"arms":{"appss-2of3":{"authorization_quorum":4,"family":"appss","holders":[1,2,3],"k":2,"n":3,"policy_id":"LOCUS-canonical-email-set-v1","result_id":"LOCUS-managed-flow-result-appss-v1","suite_id":"LOCUS-APPSS-2HASHDH-RISTRETTO255-SHA512-GF128-v1","topology_id":"LOCUS-paired-suite-deployment-2of3-v1"},"appss-3of5":{"authorization_quorum":4,"family":"appss","holders":[1,2,3,4,5],"k":3,"n":5,"policy_id":"LOCUS-location-person-set-v1","result_id":"LOCUS-managed-flow-result-appss-v1","suite_id":"LOCUS-APPSS-2HASHDH-RISTRETTO255-SHA512-GF128-v1","topology_id":"LOCUS-paired-suite-deployment-3of5-v1"},"yi-2of3":{"authorization_quorum":4,"family":"yi","holders":[1,2,3],"k":2,"n":3,"policy_id":"LOCUS-canonical-email-set-v1","result_id":"LOCUS-managed-flow-result-yi-v1","suite_id":"LOCUS-TPASS-YI-ZK-RISTRETTO255-v1","topology_id":"LOCUS-paired-suite-deployment-2of3-v1"},"yi-3of5":{"authorization_quorum":4,"family":"yi","holders":[1,2,3,4,5],"k":3,"n":5,"policy_id":"LOCUS-location-person-set-v1","result_id":"LOCUS-managed-flow-result-yi-v1","suite_id":"LOCUS-TPASS-YI-ZK-RISTRETTO255-v1","topology_id":"LOCUS-paired-suite-deployment-3of5-v1"}},"evidence_profile_id":"LOCUS-managed-flow-evidence-profile-v1","format_id":"LOCUS-managed-flow-scenario-manifest-v1","report_count":30,"reports":[{"arm_id":"yi-2of3","result_id":"LOCUS-managed-flow-result-yi-v1","scenario_id":"NF01"},{"arm_id":"appss-2of3","result_id":"LOCUS-managed-flow-result-appss-v1","scenario_id":"NF01"},{"arm_id":"yi-3of5","result_id":"LOCUS-managed-flow-result-yi-v1","scenario_id":"NF01"},{"arm_id":"appss-3of5","result_id":"LOCUS-managed-flow-result-appss-v1","scenario_id":"NF01"},{"arm_id":"yi-2of3","result_id":"LOCUS-managed-flow-result-yi-v1","scenario_id":"NF02"},{"arm_id":"appss-2of3","result_id":"LOCUS-managed-flow-result-appss-v1","scenario_id":"NF02"},{"arm_id":"yi-3of5","result_id":"LOCUS-managed-flow-result-yi-v1","scenario_id":"NF02"},{"arm_id":"appss-3of5","result_id":"LOCUS-managed-flow-result-appss-v1","scenario_id":"NF02"},{"arm_id":"yi-2of3","result_id":"LOCUS-managed-flow-result-yi-v1","scenario_id":"NF03"},{"arm_id":"appss-2of3","result_id":"LOCUS-managed-flow-result-appss-v1","scenario_id":"NF03"},{"arm_id":"yi-3of5","result_id":"LOCUS-managed-flow-result-yi-v1","scenario_id":"NF03"},{"arm_id":"appss-3of5","result_id":"LOCUS-managed-flow-result-appss-v1","scenario_id":"NF03"},{"arm_id":"yi-2of3","result_id":"LOCUS-managed-flow-result-yi-v1","scenario_id":"NF04"},{"arm_id":"appss-2of3","result_id":"LOCUS-managed-flow-result-appss-v1","scenario_id":"NF04"},{"arm_id":"yi-3of5","result_id":"LOCUS-managed-flow-result-yi-v1","scenario_id":"NF04"},{"arm_id":"appss-3of5","result_id":"LOCUS-managed-flow-result-appss-v1","scenario_id":"NF04"},{"arm_id":"yi-2of3","result_id":"LOCUS-managed-flow-result-yi-v1","scenario_id":"NF05"},{"arm_id":"appss-2of3","result_id":"LOCUS-managed-flow-result-appss-v1","scenario_id":"NF05"},{"arm_id":"yi-3of5","result_id":"LOCUS-managed-flow-result-yi-v1","scenario_id":"NF05"},{"arm_id":"appss-3of5","result_id":"LOCUS-managed-flow-result-appss-v1","scenario_id":"NF05"},{"arm_id":"yi-2of3","result_id":"LOCUS-managed-flow-result-yi-v1","scenario_id":"NF06"},{"arm_id":"appss-2of3","result_id":"LOCUS-managed-flow-result-appss-v1","scenario_id":"NF06"},{"arm_id":"yi-3of5","result_id":"LOCUS-managed-flow-result-yi-v1","scenario_id":"NF06"},{"arm_id":"appss-3of5","result_id":"LOCUS-managed-flow-result-appss-v1","scenario_id":"NF06"},{"arm_id":"managed-common","result_id":"LOCUS-managed-flow-result-common-v1","scenario_id":"NF07"},{"arm_id":"managed-common","result_id":"LOCUS-managed-flow-result-common-v1","scenario_id":"NF08"},{"arm_id":"managed-common","result_id":"LOCUS-managed-flow-result-common-v1","scenario_id":"NF09"},{"arm_id":"managed-common","result_id":"LOCUS-managed-flow-result-common-v1","scenario_id":"NF10"},{"arm_id":"managed-common","result_id":"LOCUS-managed-flow-result-common-v1","scenario_id":"NF11"},{"arm_id":"managed-common","result_id":"LOCUS-managed-flow-result-common-v1","scenario_id":"NF12"}],"scenario_contracts":{"NF01":["C07","C08","C09","C10","C11","C12","C13"],"NF02":["C07","C08","C09","C10","C11","C13","C16"],"NF03":["C08","C09","C10","M02"],"NF04":["C08","C09","C11","C12","C13","C16"],"NF05":["C09","C11"],"NF06":["C11","C12","C13"],"NF07":["C14","C15","M01"],"NF08":["C14","C15","M03"],"NF09":["C14","C15","M04"],"NF10":["C14","C15","M03"],"NF11":["C14","C15","M05"],"NF12":["C07","C08","C09","C10","C11","C12","C13","C14","C15","C16","C21","C22","C26","M01","M02","M03","M04","M05"]},"status":"assigned","trace_policy_id":"LOCUS-managed-flow-trace-policy-v1"}
